root@comp3134-lamp-ubuntu-101435500:~# tcpdump -r 001.pcap
reading from file 001.pcap, link-type EN10MB (Ethernet), snapshot length 262144
18:34:43.233942 IP comp3134-lamp-ubuntu-101435500.ssh > 162.243.188.66.24926: Flags [P.], seq 1706525958:1706526022, ack 3948419847, win 501, options [nop,nop,TS val 39858837 ecr 1623105178], length 64
18:34:43.234003 IP comp3134-lamp-ubuntu-101435500.ssh > 162.243.188.66.24926: Flags [P.], seq 64:144, ack 1, win 501, options [nop,nop,TS val 39858837 ecr 1623105178], length 80
18:34:43.234039 IP comp3134-lamp-ubuntu-101435500.ssh > 162.243.188.66.24926: Flags [P.], seq 144:224, ack 1, win 501, options [nop,nop,TS val 39858837 ecr 1623105178], length 80
18:34:43.234071 IP comp3134-lamp-ubuntu-101435500.ssh > 162.243.188.66.24926: Flags [P.], seq 224:304, ack 1, win 501, options [nop,nop,TS val 39858837 ecr 1623105178], length 80
18:34:43.234099 IP comp3134-lamp-ubuntu-101435500.ssh > 162.243.188.66.24926: Flags [P.], seq 304:368, ack 1, win 501, options [nop,nop,TS val 39858837 ecr 1623105178], length 64
18:34:43.243540 IP 162.243.188.66.24926 > comp3134-lamp-ubuntu-101435500.ssh: Flags [.], ack 0, win 1015, options [nop,nop,TS val 1623105196 ecr 39858832], length 0
18:34:43.249101 IP 162.243.188.66.24926 > comp3134-lamp-ubuntu-101435500.ssh: Flags [.], ack 64, win 1015, options [nop,nop,TS val 1623105201 ecr 39858837], length 0
18:34:43.249151 IP 162.243.188.66.24926 > comp3134-lamp-ubuntu-101435500.ssh: Flags [.], ack 144, win 1015, options [nop,nop,TS val 1623105201 ecr 39858837], length 0
18:34:43.249277 IP 162.243.188.66.24926 > comp3134-lamp-ubuntu-101435500.ssh: Flags [.], ack 224, win 1015, options [nop,nop,TS val 1623105201 ecr 39858837], length 0
18:34:43.249300 IP 162.243.188.66.24926 > comp3134-lamp-ubuntu-101435500.ssh: Flags [.], ack 304, win 1015, options [nop,nop,TS val 1623105201 ecr 39858837], length 0