root@comp3134-lamp-ubuntu-101435500:~# tcpdump -c 10 -i eth0 tcp
tcpdump: verbose output suppressed, use -v[v]... for full protocol decode
listening on eth0, link-type EN10MB (Ethernet), snapshot length 262144 bytes
18:37:32.428022 IP comp3134-lamp-ubuntu-101435500.ssh > 162.243.188.66.24926: Flags [P.], seq 1706539558:1706539686, ack 3948425415, win 501, options [nop,nop,TS val 40028031 ecr 1623274371], length 128
18:37:32.428140 IP comp3134-lamp-ubuntu-101435500.ssh > 162.243.188.66.24926: Flags [P.], seq 128:272, ack 1, win 501, options [nop,nop,TS val 40028032 ecr 1623274371], length 144
18:37:32.428187 IP comp3134-lamp-ubuntu-101435500.ssh > 162.243.188.66.24926: Flags [P.], seq 272:352, ack 1, win 501, options [nop,nop,TS val 40028032 ecr 1623274371], length 80
18:37:32.428220 IP comp3134-lamp-ubuntu-101435500.ssh > 162.243.188.66.24926: Flags [P.], seq 352:432, ack 1, win 501, options [nop,nop,TS val 40028032 ecr 1623274371], length 80
18:37:32.428247 IP comp3134-lamp-ubuntu-101435500.ssh > 162.243.188.66.24926: Flags [P.], seq 432:496, ack 1, win 501, options [nop,nop,TS val 40028032 ecr 1623274371], length 64
18:37:32.440324 IP 162.243.188.66.24926 > comp3134-lamp-ubuntu-101435500.ssh: Flags [.], ack 0, win 1015, options [nop,nop,TS val 1623274392 ecr 40028029], length 0
18:37:32.444063 IP 162.243.188.66.24926 > comp3134-lamp-ubuntu-101435500.ssh: Flags [.], ack 128, win 1015, options [nop,nop,TS val 1623274395 ecr 40028031], length 0
18:37:32.444134 IP 162.243.188.66.24926 > comp3134-lamp-ubuntu-101435500.ssh: Flags [.], ack 272, win 1015, options [nop,nop,TS val 1623274395 ecr 40028032], length 0
18:37:32.444134 IP 162.243.188.66.24926 > comp3134-lamp-ubuntu-101435500.ssh: Flags [.], ack 352, win 1015, options [nop,nop,TS val 1623274395 ecr 40028032], length 0
18:37:32.444200 IP 162.243.188.66.24926 > comp3134-lamp-ubuntu-101435500.ssh: Flags [.], ack 432, win 1015, options [nop,nop,TS val 1623274395 ecr 40028032], length 0
10 packets captured
31 packets received by filter
0 packets dropped by kernel